Closed,RAAM,PT Tripar Multivision Plus Tbk.,Energy,Entertainment & Movie Production,Utama,Rp 234,0.24786324786324787,0.2465753424657534,0.24725274725274726,0.2444933920704846,0.24778761061946902,-0.06382978723404255,-0.06818181818181818,1.0427350427350428,"Bidang perfilman, khususnya produksi film, pascaproduksi film dan distribusi film","Multivision Tower, Lt. 21 – 23 Jl. Kuningan Mulia Lot 9B, Kuningan Jakarta Selatan 12980, Indonesia",https://www.mvpworld.com,9.292.000 Lot,15%,AI - KAY HIAN SEKURITAS,AI - KAY HIAN SEKURITASAZ - SUCOR SEKURITAS,2023-04-11,2023-04-18,224,250,2023-05-02,2023-05-04,2023-05-04,2023-05-05,08 May 2023,0.0,
Closed,AWAN,PT Era Digital Media Tbk,Telecom,,Pengembangan,Rp 100,0.35,0.34814814814814815,0.34065934065934067,0.2459016393442623,0.02631578947368421,-0.0641025641025641,-0.0684931506849315,2.08,Jasa Konten SMS Premium dan Aktivitas Perusahaan Holding,"Jl. Cikini Raya No. 72, Desa/Kelurahan Cikini, Kec. Menteng, Kota Adm. Jakarta Pusat, Provinsi DKI Jakarta, Kode Pos: 10330",https://ptedm.com/,7.500.000 Lot,21.83%,IF - SAMUEL SEKURITAS INDONESIA,IF - SAMUEL SEKURITAS INDONESIAAZ - SUCOR SEKURITAS,2023-03-28,2023-03-31,100,110,2023-04-12,2023-04-14,2023-04-14,2023-04-17,18 Apr 2023,0.0,
Closed,MENN,PT Menn Teknologi Indonesia Tbk,Telecom,Electronic Equipment & Instruments,Akselerasi,Rp 78,-0.08974358974358974,-0.09859154929577464,-0.09375,-0.08620689655172414,0.018867924528301886,-0.037037037037037035,-0.038461538461538464,-0.7948717948717948,Bergerak Dalam Bidang Teknologi Digital Penyedia Solusi Sistem Informasi Berbasis Internet of Things,"Mall Ambasador Lt.5 No. 9F Jl. Prof. Dr. Satrio, Karet Kuningan, Setiabudi, Jakarta Selatan, Indonesia - 12940",https://www.menngroup.id,4.302.000 Lot,30%,IU - INDO CAPITAL SEKURITAS,IU - INDO CAPITAL SEKURITASHD - KGI SEKURITAS INDONESIA,2023-03-27,2023-03-31,75,80,2023-04-12,2023-04-14,2023-04-14,2023-04-17,18 Apr 2023,0.67,Rp 98
Closed,MBMA,PT Merdeka Battery Materials Tbk.,Utilities,Diversified Metals & Minerals,,Rp 795,0.11320754716981132,-0.06779661016949153,-0.006060606060606061,0.012195121951219513,-0.030120481927710843,-0.012422360248447204,0.012578616352201259,-0.2830188679245283,Grup usaha di sektor nikel dan mineral lainnya yang terintegrasi secara vertikal,"Treasury Tower Lantai 69, District 8, SCBD Lot 28 Jl Jend. Sudirman Kav. 52-53, Jakarta Selatan 12190, DKI Jakarta",https://www.merdekabattery.com/,110.000.000 Lot,10.24%,PD - INDO PREMIER SEKURITAS,PD - INDO PREMIER SEKURITASAZ - SUCOR SEKURITASRX - MACQUARIE SEKURITAS INDONESIAPP - ALDIRACITA SEKURITAS INDONESIALG - TRIMEGAH SEKURITAS INDONESIA TBK.KI - CIPTADANA SEKURITAS ASIAAK - UBS SEKURITAS INDONESIA,2023-03-28,2023-04-04,780,795,2023-04-12,2023-04-14,2023-04-14,2023-04-17,18 Apr 2023,0.0,
Closed,NCKL,PT Trimegah Bangun Persada Tbk,Utilities,Diversified Metals & Minerals,Utama,Rp 1.250,0.044,0.03065134099616858,0.022304832713754646,0.01818181818181818,0.03214285714285714,-0.06920415224913495,0.01486988847583643,-0.276,Bergerak di bidang usaha Pertambangan Bijih Nikel,"Gedung Bank Panin Lt. 2 Jalan Jendral Sudirman Kav. 1 Kelurahan Gelora, Kecamatan Tanah Abang, Jakarta Pusat 10270",https://www.tbpnickel.com,79.976.000 Lot,12.67%,CC - MANDIRI SEKURITAS,CC - MANDIRI SEKURITASY0 - BNP Paribas Sekuritas IndonesiaAI - KAY HIAN SEKURITASC4 - CITIGROUP SEKURITAS INDONESIACS - CREDIT SUISSE SEKURITAS INDONESIATP - OCBC SEKURITAS INDONESIADP - DBS VICKERS SEKURITAS INDONESIA,2023-03-15,2023-03-24,1220,1250,2023-04-05,2023-04-10,2023-04-10,2023-04-11,12 Apr 2023,0.0,
Closed,PIPA,PT Multi Makmur Lemindo Tbk,Consumer Discretionary,Building Products & Fixtures,Pemantauan Khusus,Rp 105,0.34285714285714286,0.3475177304964539,0.015789473684210527,-0.06735751295336788,-0.06666666666666667,-0.06547619047619048,-0.06369426751592357,-0.9047619047619048,Bergerak di bidang manufaktur material bahan bangunan dari plastik berbahan dasar PVC dan perdagang,"Jl. Sultan Iskandar Muda No.70, Kedaung Baru, Neglasari Tangerang, Banten. 15128",https://www.multimakmurlemindo.com,9.250.000 Lot,27.01%,AH - SHINHAN SEKURITAS INDONESIA,AH - SHINHAN SEKURITAS INDONESIA,2023-03-15,2023-03-21,100,110,2023-04-03,2023-04-05,2023-04-05,2023-04-06,10 Apr 2023,0.9,Rp 110
Closed,HAJJ,PT Arsy Buana Travelindo Tbk,Energy,Travel Agencies,Akselerasi,Rp 140,0.1,0.09740259740259741,0.09467455621301775,0.04864864864864865,-0.0979381443298969,0.08571428571428572,0.09473684210526316,-0.07857142857142857,Perseroan bergerak dalam bidang Jasa Penyedia Akomodasi Perjalanan Wisata,"Ruko Harvest No. 3, Jl. Merpati Raya, Kel. Sawah, Kec. Ciputat, Kota Tangerang Selatan, 15413",https://abttravel.id/,6.871.000 Lot,29.99%,SF - SURYA FAJAR SEKURITAS,SF - SURYA FAJAR SEKURITAS,2023-02-24,2023-03-09,140,145,2023-03-28,2023-04-03,2023-04-03,2023-04-04,05 Apr 2023,0.8,Rp 175
Closed,GTRA,PT Grahaprima Suksesmandiri Tbk,Real Estate,Logistics & Deliveries,Pengembangan,Rp 150,0.3466666666666667,0.24752475247524752,0.06349206349206349,-0.04477611940298507,0.0859375,-0.03597122302158273,-0.06716417910447761,-0.18,Bergerak dalam bidang angkutan bermotor untuk barang umum,"Gedung Graha 55 Lt.3, Jalan Tanah Abang II No. 57 Kel. Petojo Selatan, Kec. Gambir, Jakarta Pusat 10160, Indonesia",https://www.grahatrans.com,3.788.750 Lot,20%,AI - KAY HIAN SEKURITAS,AI - KAY HIAN SEKURITAS,2023-02-27,2023-03-06,100,150,2023-03-21,2023-03-28,2023-03-28,2023-03-29,30 Mar 2023,0.0,
Closed,NSSS,PT Nusantara Sawit Sejahtera Tbk,Consumer Staples,Plantations & Crops,Pengembangan,Rp 127,0.06299212598425197,-0.05185185185185185,0.015625,0.023076923076923078,-0.015037593984962405,0.05343511450381679,0.0,0.5275590551181102,Aktivitas Perusahaan Holding dan Aktivitas Konsultasi Manajemen Lainnya,"Menara Imperium LT20, Suite C, Jalan H.R. Rasuna Said Kav.1, Kelurahan Guntur, Kecamatan Setiabudi, Kota Administrasi Jakarta Selatan 12980, Provinsi DKI Jakarta",https://nssgroup.id/,35.682.353 Lot,15%,IF - SAMUEL SEKURITAS INDONESIA,IF - SAMUEL SEKURITAS INDONESIAAZ - SUCOR SEKURITASRS - YULIE SEKURITAS INDONESIA TBK.OD - BRI DANAREKSA SEKURITASPF - DANASAKTI SEKURITAS INDONESIAKK - PHILLIP SEKURITAS INDONESIAYP - MIRAE ASSET SEKURITAS INDONESIA,2023-02-17,2023-02-22,122,190,2023-03-02,2023-03-08,2023-03-08,2023-03-09,10 Mar 2023,0.5,Rp 190
Closed,SAGE,PT Saptausaha Gemilangindah Tbk,Technology,Real Estate Development & Management,Pemantauan Khusus,Rp 100,0.35,0.2814814814814815,-0.06936416184971098,-0.06832298136645963,-0.06666666666666667,-0.06428571428571428,-0.06870229007633588,-0.87,Bergerak dalam bidang real estat,"Jl. Kramat Raya No. 32-34 Kel. Kramat Kec. Senen, Jakarta Pusat, DKI Jakarta 10450",https://www.saptagroup.com/,16.100.000 Lot,20.04%,II - DANATAMA MAKMUR SEKURITAS,II - DANATAMA MAKMUR SEKURITASSH - ARTHA SEKURITAS INDONESIA,2023-02-16,2023-02-22,100,125,2023-03-02,2023-03-06,2023-03-06,2023-03-07,08 Mar 2023,1.25,Rp 110
Closed,TRON,PT Teknologi Karya Digital Nusa Tbk,Telecom,IT Services & Consulting,Pengembangan,Rp 180,0.3111111111111111,0.15254237288135594,0.051470588235294115,-0.06993006993006994,0.015037593984962405,0.06666666666666667,0.0,-0.35,Bergerak dalam bidang penyediaan solusi sistem informasi berbasis telematika dan Internet of Things,"Mini Office Central 88 Blok G1 No. 826, Jl. Trembesi Pademangan Timur, Kec. Pademangan Kota Adm. Jakarta Utara",https://www.tkdn.co.id,7.500.000 Lot,25.42%,SF - SURYA FAJAR SEKURITAS,SF - SURYA FAJAR SEKURITAS,2023-02-10,2023-02-20,140,220,2023-03-02,2023-03-06,2023-03-06,2023-03-07,08 Mar 2023,0.5,Rp 250
Closed,CUAN,PT Petrindo Jaya Kreasi Tbk,Financials,Coal Production,Utama,Rp 220,0.24545454545454545,0.24817518248175183,0.24561403508771928,0.24413145539906103,0.24528301886792453,0.25,-0.06666666666666667,35.36363636363637,Pertambangan Batubara,"Gedung Wisma Barito Pacific, lantai 3 B Jl. Let. Jend. S. Parman Kav. 62-63, Jakarta.",https://petrindo.co.id,16.900.000 Lot,15.03%,HP - HENAN PUTIHRAI SEKURITAS,HP - HENAN PUTIHRAI SEKURITASOD - BRI DANAREKSA SEKURITAS,2023-02-17,2023-02-22,200,220,2023-03-02,2023-03-06,2023-03-06,2023-03-07,08 Mar 2023,0.0,
Closed,PTMP,PT Mitra Pack Tbk,Consumer Discretionary,Diversified Industrial Trading,Pengembangan,Rp 120,0.19166666666666668,-0.02097902097902098,-0.02142857142857143,0.014598540145985401,-0.02158273381294964,-0.03676470588235294,-0.015267175572519083,-0.23333333333333334,distributor resmi & penyewaan barang-barang industri pengemasan termasuk suku cadang dan service...,"Jl Pangeran Jayakarta Komplek 135 Blok B-20 Mangga Dua Selatan, Sawah Besar, Jakarta Pusat",https://www.mitrapack.co.id,8.000.000 Lot,25.24%,XA - NH KORINDO SEKURITAS INDONESIA,XA - NH KORINDO SEKURITAS INDONESIA,2023-02-07,2023-02-09,100,120,2023-02-27,2023-03-02,2023-03-02,2023-03-03,06 Mar 2023,0.0,
Closed,BDKR,PT Berdikari Pondasi Perkasa Tbk,Materials,Heavy Constructions & Civil Engineering,Utama,Rp 200,0.15,0.06956521739130435,-0.024390243902439025,-0.041666666666666664,0.12173913043478261,-0.023255813953488372,0.023809523809523808,3.5,"Bergerak dalam bidang pondasi, perbaikan tanah, konstruksi dermaga, alat berat dan penyewaan crane","Jl. Bandengan Utara No. 32B RT 008 RW 011 Pekojan, Tambora – Jakarta Barat",https://www.ptbppid.com,7.061.000 Lot,15%,MG - SEMESTA INDOVEST SEKURITAS,MG - SEMESTA INDOVEST SEKURITAS,2023-02-06,2023-02-10,188,200,2023-02-27,2023-03-01,2023-03-01,2023-03-02,03 Mar 2023,0.5,Rp 500
Closed,HILL,PT Hillcon Tbk,Utilities,Diversified Metals & Minerals,Utama,Rp 1.250,0.064,0.12406015037593984,0.010033444816053512,0.033112582781456956,0.01282051282051282,0.03164556962025317,0.006134969325153374,0.712,"Aktivitas Perusahaan Holding, Aktivitas Konsultasi Manajemen, Jasa Pertambangan dan Jasa Konstruksi","Blok R2, Jl. Taman Modern No. 19 RT.014/RW.006, Ujung Menteng, Kecamatan Cakung, Kota Jakarta Timur, Daerah Khusus Ibukota Jakarta 13960",https://www.hillcon.co.id/,4.423.000 Lot,15%,YP - MIRAE ASSET SEKURITAS INDONESIA,YP - MIRAE ASSET SEKURITAS INDONESIAAZ - SUCOR SEKURITASRX - MACQUARIE SEKURITAS INDONESIA,2023-01-12,2023-02-03,1250,2000,2023-02-23,2023-02-27,2023-02-27,2023-02-28,01 Mar 2023,0.0,
Closed,FUTR,PT Lini Imaji Kreasi Ekosistem Tbk,Energy,Advertising,Pemantauan Khusus,Rp 100,0.0,0.21,0.34710743801652894,-0.06748466257668712,-0.06578947368421052,0.056338028169014086,-0.06666666666666667,-0.39,"Bergerak dalam bidang periklanan, aktivitas desain khusus film, video, program TV, animasi dan komik","Fatmawati Mas Blok III No. 307-309 Jl. RS Fatmawati No 20 Jakarta Selatan, Indonesia",https://futurphuture.io/,12.780.000 Lot,20%,IU - INDO CAPITAL SEKURITAS,IU - INDO CAPITAL SEKURITASHD - KGI SEKURITAS INDONESIA,2023-02-01,2023-02-07,100,120,2023-02-21,2023-02-23,2023-02-23,2023-02-24,27 Feb 2023,0.8,Rp 135
Closed,PGEO,PT Pertamina Geothermal Energy Tbk,Materials,Electric Utilities,Utama,Rp 875,0.0,-0.05142857142857143,-0.03614457831325301,0.04375,0.041916167664670656,0.005747126436781609,-0.017142857142857144,0.32571428571428573,Menyelenggarakan usaha di bidang panas bumi dari sisi hulu dan/atau sisi hilir serta kegiatan usaha,"Grha Pertamina – Tower Pertamax Lt. 7 Jl. Medan Merdeka Timur No. 11-13 Gambir, Jakarta Pusat 10110, Indonesia",https://www.pge.pertamina.com,103.500.000 Lot,25%,CC - MANDIRI SEKURITAS,CC - MANDIRI SEKURITASCS - CREDIT SUISSE SEKURITAS INDONESIADX - BAHANA SEKURITASGW - HSBC SEKURITAS INDONESIAPF - DANASAKTI SEKURITAS INDONESIAIF - SAMUEL SEKURITAS INDONESIAKZ - CLSA SEKURITAS INDONESIA,2023-02-01,2023-02-09,820,945,2023-02-20,2023-02-22,2023-02-22,2023-02-23,24 Feb 2023,0.0,
Closed,KING,PT Hoffmen Cleanindo Tbk,Consumer Discretionary,Human Resource & Employment Services,Akselerasi,Rp 130,-0.1,-0.09401709401709402,-0.09433962264150944,0.09375,0.09523809523809523,0.09565217391304348,-0.03968253968253968,0.26153846153846155,"Jasa Cleaning Service, Security, Washroom Hygiene, Labour Supply dan Parkir melalui Perusahaan Anak",Jl. Raya Jembatan Tiga No. 8 Penjaringan Jakarta Utara 14440,https://www.hoffmen.co.id,5.200.000 Lot,20%,XA - NH KORINDO SEKURITAS INDONESIA,XA - NH KORINDO SEKURITAS INDONESIA,2023-01-25,2023-01-30,115,130,2023-02-10,2023-02-14,2023-02-14,2023-02-15,16 Feb 2023,0.5,Rp 200
Closed,VAST,PT Vastland Indonesia Tbk,Technology,Real Estate Development & Management,Pengembangan,Rp 108,-0.06481481481481481,-0.04950495049504951,0.25,-0.06666666666666667,-0.03571428571428571,-0.027777777777777776,0.02857142857142857,-0.3333333333333333,Real Estate yang Dimiliki Sendiri atau Disewa,"Jl. Tembesu No. 8A, Kel. Campang Raya, Sukabumi, Bandar Lampung, Lampung 35122",https://www.vastland.co.id,6.500.000 Lot,21.27%,AO - ERDIKHA ELIT SEKURITAS,AO - ERDIKHA ELIT SEKURITAS,2023-01-16,2023-01-20,100,109,2023-02-01,2023-02-06,2023-02-06,2023-02-07,08 Feb 2023,0.2,Rp 338
Closed,CHIP,PT Pelita Teknologi Global Tbk,Telecom,Electronic Equipment & Instruments,Akselerasi,Rp 160,0.1,0.09659090909090909,0.09844559585492228,0.09433962264150944,-0.008620689655172414,0.034782608695652174,0.09243697478991597,7.28125,Bergerak dalam Bidang Aktivitas Konsultasi dan Perancangan Internet of Things & Industri Smart Card,"Jl. Gatot Subroto KM 5, No 66, Kroncong, Jatiuwung, Tangerang, Banten 15134",https://www.pelitateknologi.com,2.000.000 Lot,24.81%,YJ - LOTUS ANDALAN SEKURITAS,YJ - LOTUS ANDALAN SEKURITAS,2023-01-17,2023-01-24,140,180,2023-02-02,2023-02-06,2023-02-06,2023-02-07,08 Feb 2023,0.0,
Closed,HALO,PT Haloni Jane Tbk,Healthcare,Healthcare Equipment,Pengembangan,Rp 100,0.17,0.008547008547008548,0.11016949152542373,-0.06870229007633588,-0.02459016393442623,0.058823529411764705,-0.031746031746031744,-0.25,Bergerak dalam bidang barang dari karet untuk kesehatan,"Jl Raya Serang km. 13,8 Kawasan Industri Tristate, Sukadamai Cikupa Tangerang Indonesia",http://halonijane.co.id/,11.300.000 Lot,20%,II - DANATAMA MAKMUR SEKURITAS,II - DANATAMA MAKMUR SEKURITASCP - KB VALBURY SEKURITAS,2023-01-17,2023-01-24,100,150,2023-02-01,2023-02-06,2023-02-06,2023-02-07,08 Feb 2023,0.5,Rp 150
Closed,PACK,PT Solusi Kemasan Digital Tbk,Consumer Discretionary,Commercial Printing,Akselerasi,Rp 162,-0.09876543209876543,-0.0958904109589041,-0.06060606060606061,-0.0967741935483871,-0.08928571428571429,-0.0784313725490196,0.02127659574468085,-0.7592592592592593,Industri Percetakan Digital Untuk Kemasan Fleksibel,"JL. Jababeka 2 Blok C/11-D Kawasan Industri Jababeka Cikarang Utara Kabupaten Bekasi, Jawa Barat 17530",https://www.flexypack.com,3.080.000 Lot,20.03%,XA - NH KORINDO SEKURITAS INDONESIA,XA - NH KORINDO SEKURITAS INDONESIA,2023-01-12,2023-01-17,110,162,2023-02-02,2023-02-06,2023-02-06,2023-02-07,08 Feb 2023,0.2,Rp 350
Closed,IRSX,PT Aviana Sinar Abadi Tbk,Telecom,Software,Pemantauan Khusus,Rp 101,0.019801980198019802,-0.019417475728155338,-0.009900990099009901,-0.07,0.010752688172043012,0.010638297872340425,-0.042105263157894736,-0.8613861386138614,Bergerak di Bidang Aktivitas Pemrograman Komputer Lainnya,"Jl. Alaydrus No. 66 BC Lantai 3 - RT.10/RW.2, Petojo Utara, Gambir, Kota Jakarta Pusat Daerah Khusus Ibukota Jakarta 10130",https://aviana.co.id/,10.000.000 Lot,20%,AH - SHINHAN SEKURITAS INDONESIA,AH - SHINHAN SEKURITAS INDONESIA,2023-01-11,2023-01-17,100,101,2023-02-01,2023-02-03,2023-02-03,2023-02-06,07 Feb 2023,1.4,Rp 91
Closed,NAYZ,PT Hassana Boga Sejahtera Tbk,Consumer Staples,Processed Foods,Akselerasi,Rp 100,-0.1,-0.1,-0.09876543209876543,0.0273972602739726,-0.04,0.05555555555555555,0.06578947368421052,-0.77,Menjalankan usaha dalam bidang industri makanan bayi,"Kawasan Pergudangan Multiguna Taman Tekno 2 Blok L2 No. 35 BSD, Tangerang Selatan, Banten",https://www.hassana.co.id/,5.100.000 Lot,20%,SF - SURYA FAJAR SEKURITAS,SF - SURYA FAJAR SEKURITAS,2023-01-02,2023-01-11,100,120,2023-01-31,2023-02-02,2023-02-02,2023-02-03,06 Feb 2023,1.0,Rp 125
Closed,FWCT,PT Wijaya Cahaya Timber Tbk,Utilities,Timber,Pengembangan,Rp 118,0.3474576271186441,-0.06918238993710692,-0.06756756756756757,-0.06521739130434782,-0.06976744186046512,-0.06666666666666667,0.14285714285714285,-0.13559322033898305,Industri Kayu Lapis,"Jl. Puri Indah, Ruko Sentra Niaga Puri Indah Blok T1 No.47, Kembangan Selatan, Kembangan, Jakarta Barat, Jakarta 11610",http://wijayacahayatimber.com/,3.750.000 Lot,20%,YJ - LOTUS ANDALAN SEKURITAS,YJ - LOTUS ANDALAN SEKURITAS,2023-01-09,2023-01-16,108,118,2023-01-26,2023-01-30,2023-01-30,2023-01-31,01 Feb 2023,0.0,
Closed,LAJU,PT Jasa Berdikari Logistics Tbk,Real Estate,Logistics & Deliveries,Pengembangan,Rp 100,0.35,0.02962962962962963,-0.06474820143884892,0.007692307692307693,0.07633587786259542,0.0851063829787234,-0.058823529411764705,-0.5,Jasa Logistik Terintegrasi,"Jl. Kopi No. 4 D Lt. 2. Roa Malaka, Tambora Jakarta Barat – 11230 Telepon: 021 – 6912287",https://www.jasaberdikari.co.id,7.000.000 Lot,32.56%,XA - NH KORINDO SEKURITAS INDONESIA,XA - NH KORINDO SEKURITAS INDONESIA,2022-12-30,2023-01-06,100,150,2023-01-20,2023-01-25,2023-01-25,2023-01-26,27 Jan 2023,0.2,Rp 175
Closed,PEVE,PT Penta Valent Tbk,Healthcare,Pharmaceuticals,Pengembangan,Rp 149,0.3422818791946309,0.22,-0.05737704918032787,0.0,-0.043478260869565216,-0.06363636363636363,0.0,0.6510067114093959,Distributor Produk Farmasi dan Produk Konsumsi,"Jl. Kedoya Raya No. 33, Kedoya Utara, Kebon Jeruk 11520",http://www.pentavalent.co.id/,3.531.250 Lot,20%,YJ - LOTUS ANDALAN SEKURITAS,YJ - LOTUS ANDALAN SEKURITAS,2022-12-30,2023-01-05,120,149,2023-01-17,2023-01-19,2023-01-19,2023-01-20,24 Jan 2023,0.0,
Canceled,BSMT-C1,PT Bank Pembangunan Daerah Sumatera Utara Tbk.,Financials,Banks,,,,,,,,,,,Jasa Perbankan,"Gedung Bank SUMUT JL. Imam Bonjol No 18 Medan 20212 Sumatera Utara, Indonesia",https://www.banksumut.co.id,2934798300,23.0,OD - BRI DANAREKSA SEKURITAS,"['OD - BRI DANAREKSA SEKURITAS', 'AI - UOB KAY HIAN SEKURITAS', 'DR - RHB SEKURITAS INDONESIA', 'PP - ALDIRACITA SEKURITAS INDONESIA']",2023-01-05,2023-01-18,350,510,,,,,,0.0,
Closed,BMBL,PT Lavender Bina Cendikia Tbk,Energy,Education Services,Akselerasi,Rp 188,-0.09574468085106383,-0.1,-0.09803921568627451,-0.09420289855072464,-0.096,-0.09734513274336283,0.0,-0.9095744680851063,Pendidikan Bimbingan Belajar dan Konseling Swasta,"Office Tower Taman Melati Lt.5 Jalan Margonda Raya no.525 Depok, Jawa Barat",http://www.lavenderprograms.com/,2.800.000 Lot,27.19%,HD - KGI SEKURITAS INDONESIA,HD - KGI SEKURITAS INDONESIAYP - MIRAE ASSET SEKURITAS INDONESIA,2022-12-19,2022-12-26,187,196,2023-01-03,2023-01-09,2023-01-09,2023-01-10,11 Jan 2023,0.8,Rp 250
Closed,WINE,PT Hatten Bali Tbk,Energy,Consumer Distributors,Pengembangan,Rp 129,0.3488372093023256,0.3448275862068966,0.24786324786324787,0.1095890410958904,-0.06790123456790123,-0.06622516556291391,-0.06382978723404255,1.7751937984496124,Distribusi Minuman Beralkohol dan Pengolahannya melalui Perusahaan Anak,"Hatten Wines Building Jl. Bypass Ngurah Rai No. 393, Sanur, Bali",https://www.hattenbali.co.id,6.780.000 Lot,25.02%,XA - NH KORINDO SEKURITAS INDONESIA,XA - NH KORINDO SEKURITAS INDONESIA,2022-12-19,2022-12-22,100,150,2023-01-03,2023-01-06,2023-01-06,2023-01-09,10 Jan 2023,0.0,
Closed,SUNI,PT Sunindo Pratama Tbk,Financials,"Oil, Gas & Coal Equipment & Services",Utama,Rp 300,0.0,-0.03333333333333333,0.10344827586206896,-0.05625,0.0,-0.019867549668874173,0.006756756756756757,1.4166666666666667,"Bergerak dalam bidang perdagangan besar mesin, peralatan dan perlengkapan lainnya, perdagangan besar","Jl. Prof Dr. Soepomo SH. No. 48, Tebet Jakarta Selatan 12870, Indonesia",https://www.sunindogroup.com,6.000.000 Lot,24%,AI - KAY HIAN SEKURITAS,AI - KAY HIAN SEKURITAS,2022-12-19,2022-12-23,280,300,2023-01-02,2023-01-05,2023-01-05,2023-01-06,09 Jan 2023,0.0,
Closed,CBRE,PT Cakra Buana Resources Energi Tbk,Financials,Coal Distribution,Pemantauan Khusus,Rp 108,0.3425925925925926,0.3448275862068966,-0.06666666666666667,-0.06593406593406594,-0.06470588235294118,-0.06918238993710692,0.0472972972972973,-0.8148148148148148,Angkutan Laut Dalam Negeri Untuk Barang Umum,"Sona Topas Tower Lt. 5A, Jl. Jenderal Sudirman Kav. 26, Jakarta Selatan 12920, Indonesia",https://www.cbre.co.id,7.380.000 Lot,16.26%,DR - RHB SEKURITAS INDONESIA,DR - RHB SEKURITAS INDONESIAHD - KGI SEKURITAS INDONESIA,2022-12-13,2022-12-16,100,110,2023-01-02,2023-01-05,2023-01-05,2023-01-06,09 Jan 2023,1.8,Rp 258
Closed,BEER,PT Jobubu Jarum Minahasa Tbk,Consumer Staples,Liquors,Pengembangan,Rp 220,0.17272727272727273,0.015503875968992248,-0.007633587786259542,0.007692307692307693,0.04580152671755725,-0.0072992700729927005,0.03676470588235294,-0.12727272727272726,"Industri Minuman Beralkohol Hasil Destilasi, Industri Minuman Beralkohol Hasil Fermentasi Anggur","Desa Kapitu, Kelurahan Kapitu, Kecamatan Amurang Barat, Kabupaten Minahasa Selatan, Provinsi Sulawesi Utara",http://www.jobubu.com/,8.000.000 Lot,20%,AI - KAY HIAN SEKURITAS,AI - KAY HIAN SEKURITAS,2022-12-16,2022-12-22,200,220,2023-01-02,2023-01-04,2023-01-04,2023-01-05,06 Jan 2023,0.0,
Closed,ELIT,PT Data Sinergitama Jaya Tbk,Telecom,IT Services & Consulting,Pengembangan,Rp 120,-0.06666666666666667,0.3482142857142857,0.11920529801324503,-0.011834319526627219,0.011976047904191617,-0.0650887573964497,-0.06962025316455696,-0.11666666666666667,Bidang Usaha Penyedia Layanan (managed service) di Bidang Teknologi Informasi (Cloud),"The Manhattan Squre Tower B Lt. 22, Jl. TB Simatupang, RT.3/RW.3, Cilandak Timur, Pasar Minggu, Jakarta Selatan,12560 Telepon: 0217511004",https://www.elitery.com,5.000.000 Lot,24.61%,XA - NH KORINDO SEKURITAS INDONESIA,XA - NH KORINDO SEKURITAS INDONESIA,2022-12-16,2022-12-22,120,150,2023-01-02,2023-01-04,2023-01-04,2023-01-05,06 Jan 2023,0.5,Rp 150
Closed,CBPE,PT Citra Buana Prasida Tbk,Technology,Real Estate Development & Management,Pengembangan,Rp 150,-0.006666666666666667,-0.006711409395973154,0.02702702702702703,0.2631578947368421,-0.06770833333333333,-0.0670391061452514,-0.0658682634730539,0.30666666666666664,Bergerak di bidang real estat dan property,"Komplek Paskal Hyper Square Blok G Lantai 2 No. 206 – 208, Jl. H.O.S. Cokroaminoto No. 25 – 27 (dh. Jl. Pasirkaliki No. 25 – 27), Bandung 40181, Tel.: (022) 8606 1108",https://www.citrabuanaprasida.co.id,2.712.500 Lot,20%,GR - PANIN SEKURITAS TBK.,GR - PANIN SEKURITAS TBK.,2022-12-19,2022-12-23,100,150,2023-01-02,2023-01-04,2023-01-04,2023-01-05,06 Jan 2023,0.0,
Closed,SOUL,PT Mitra Tirta Buwana Tbk,Consumer Staples,Food Retail & Distributors,Akselerasi,Rp 110,-0.1,-0.09090909090909091,-0.1,-0.09876543209876543,-0.0410958904109589,-0.1,-0.09523809523809523,-0.8363636363636363,Bergerak dalam bidang usaha Air Minum Dalam Kemasan,"Jl. Waru No. 74 Sambilegi Baru RT.001 RW.003 Maguwoharjo, Depok, Sleman Yogyakarta - Indonesia, 55282",http://hexsoul.co.id/,2.700.000 Lot,24.94%,AN - WANTEG SEKURITAS,AN - WANTEG SEKURITASAH - SHINHAN SEKURITAS INDONESIA,2022-12-19,2022-12-26,100,110,2023-01-02,2023-01-04,2023-01-04,2023-01-05,06 Jan 2023,0.25,Rp 100
Closed,VTNY,PT Venteny Fortuna International Tbk,Industrials,Consumer Financing,Utama,Rp 360,0.1,-0.045454545454545456,0.0,0.031746031746031744,0.03076923076923077,0.014925373134328358,-0.0196078431372549,-0.6416666666666667,Aktivitas Perusahaan Holding dan Aktivitas Pengembangan Aplikasi Perdagangan Melalui Internet,"World Trade Centre (WTC) 5 Lantai 13, Jl. Jend. Sudirman Kav. 29-31, Jakarta Selatan, 12920",https://www.venteny.com,9.397.791 Lot,15%,SF - SURYA FAJAR SEKURITAS,SF - SURYA FAJAR SEKURITASCD - MEGA CAPITAL SEKURITASOD - BRI DANAREKSA SEKURITASYP - MIRAE ASSET SEKURITAS INDONESIA,2022-11-21,2022-11-29,350,450,2022-12-09,2022-12-13,2022-12-13,2022-12-14,15 Dec 2022,0.0,
Closed,ISAP,PT Isra Presisi Indonesia Tbk,Energy,Auto Parts & Equipment,Akselerasi,Rp 96,-0.09375,-0.09195402298850575,-0.08860759493670886,-0.09722222222222222,0.09230769230769231,0.09859154929577464,0.08974358974358974,-0.90625,Industri Mesin dan Perkakas Mesin untuk Pengerjaan Logam,"Kawasan Industri Delta Silicon III Lippo Cikarang Bekasi Jawa Barat, 17530",https://www.isra.co.id/en,15.000.000 Lot,37.31%,AI - KAY HIAN SEKURITAS,AI - KAY HIAN SEKURITAS,2022-11-07,2022-11-14,95,100,2022-12-01,2022-12-07,2022-12-07,2022-12-08,09 Dec 2022,0.5,Rp 125
Closed,PADA,PT Personel Alih Daya Tbk,Consumer Discretionary,Human Resource & Employment Services,Pemantauan Khusus,Rp 100,0.1,-0.05454545454545454,-0.028846153846153848,-0.039603960396039604,0.13402061855670103,-0.02727272727272727,-0.009345794392523364,-0.86,"Jasa Teknikal dan Pemeliharaan Peralatan Telekomunikasi, Call Center, Perkantoran, Keamanan dan SDM","Jl. Kebagusan 1 No. 4, Kebagusan, Pasar Minggu, Jakarta Selatan, Kode Pos 12520, Indonesia",https://www.persada.id,9.000.000 Lot,28.57%,AI - KAY HIAN SEKURITAS,AI - KAY HIAN SEKURITASAO - ERDIKHA ELIT SEKURITAS,2022-11-16,2022-11-22,100,120,2022-12-02,2022-12-06,2022-12-06,2022-12-07,08 Dec 2022,0.0,
Closed,MMIX,PT Multi Medika Internasional Tbk,Consumer Staples,Household Products,Pengembangan,Rp 190,0.3473684210526316,-0.0625,-0.06666666666666667,0.05357142857142857,0.025423728813559324,-0.01652892561983471,0.07563025210084033,-0.6210526315789474,"Perdagangan Besar Alat Laboratorium, Alat Farmasi dan Alat Kedokteran Untuk Manusia, dan Sewa Guna U","PT. Multi Medika Internasional Tbk Jl. Peternakan III No.55B, Kelurahan Kapuk, Kecamatan Cengkareng, Jakarta Barat – DKI Jakarta, Kode Pos 11720",https://www.multimed.co.id/,6.000.000 Lot,25%,YP - MIRAE ASSET SEKURITAS INDONESIA,YP - MIRAE ASSET SEKURITAS INDONESIA,2022-11-15,2022-11-22,160,210,2022-11-30,2022-12-02,2022-12-02,2022-12-05,06 Dec 2022,0.5,Rp 300
