Closed,GOTO,PT GoTo Gojek Tokopedia Tbk,Telecom,Online Applications & Services,Ekonomi Baru,Rp 338,0.1301775147928994,-0.031413612565445025,0.010810810810810811,0.0053475935828877,0.005319148936170213,-0.05291005291005291,-0.055865921787709494,-0.7928994082840237,"Penyedia platform digital yang mengintegrasikan on-demand services, e-commerce dan fintech services","Gedung Pasaraya Blok M, lantai 6-7 Jl. Iskandarsyah II No. 2, Jakarta 12160",https://www.gotocompany.com,406.150.560 Lot,3.43%,CC - MANDIRI SEKURITAS,CC - MANDIRI SEKURITASC3 - PT CIMB Niaga SekuritasD4 - PT Deutsche Sekuritas IndonesiaGR - PANIN SEKURITAS TBK.AZ - SUCOR SEKURITASCS - CREDIT SUISSE SEKURITAS INDONESIANI - BNI SEKURITASPP - ALDIRACITA SEKURITAS INDONESIALG - TRIMEGAH SEKURITAS INDONESIA TBK.RO - PLUANG MAJU SEKURITASPD - INDO PREMIER SEKURITASKZ - CLSA SEKURITAS INDONESIACP - KB VALBURY SEKURITAS,2022-03-15,2022-03-24,316,346,2022-04-01,2022-04-07,2022-04-07,2022-04-08,11 Apr 2022,0.0,
Closed,SICO,PT Sigma Energy Compressindo Tbk,Financials,"Oil, Gas & Coal Equipment & Services",Pengembangan,Rp 230,0.10434782608695652,-0.06299212598425197,-0.06722689075630252,-0.06306306306306306,-0.0673076923076923,-0.06701030927835051,-0.022099447513812154,-0.5304347826086957,Jasa Penyewaan Alat-Alat Untuk Monetisasi Minyak dan Gas Suar Bakar dengan Menggunakan Teknologi,"GKM Green Tower 10th Floor Jl. TB Simatupang Kav 89 G Jakarta Selatan, 12520",https://sinerco.co.id,2.700.000 Lot,29.67%,XA - NH KORINDO SEKURITAS INDONESIA,XA - NH KORINDO SEKURITAS INDONESIA,2022-03-15,2022-03-18,190,230,2022-04-04,2022-04-06,2022-04-06,2022-04-07,08 Apr 2022,0.1,Rp 350
Closed,WIRG,PT WIR ASIA Tbk,Telecom,Software,Pengembangan,Rp 168,0.34523809523809523,0.24778761061946902,0.24822695035460993,0.25,0.25,0.24545454545454545,0.24817518248175183,-0.4642857142857143,"Jasa teknologi informasi termasuk bidang multimedia, telekomunikasi dan periklanan",Jalan Panjang Raya No. 70 Kebon Jeruk Jakarta 11530 - Indonesia,https://www.wirglobal.com,23.370.900 Lot,20%,KI - CIPTADANA SEKURITAS ASIA,KI - CIPTADANA SEKURITAS ASIA,2022-03-14,2022-03-17,150,175,2022-03-29,2022-03-31,2022-03-31,2022-04-01,04 Apr 2022,0.3,Rp 188
Closed,BIKE,PT Sepeda Bersama Indonesia Tbk,Energy,Sport Equipment & Hobbies Goods,Pengembangan,Rp 170,0.3411764705882353,0.24561403508771928,-0.06338028169014084,-0.06766917293233082,-0.056451612903225805,-0.02564102564102564,-0.06140350877192982,2.5,Perdagangan Besar Sepeda,"Jl. Alam Sutera Boulevard Kav. 12A, Pakulon, Serpong Utara Tangerang Selatan, Banten 15325",https://www.sepedabersamaindonesia.co.id,3.233.340 Lot,25%,LG - TRIMEGAH SEKURITAS INDONESIA TBK.,LG - TRIMEGAH SEKURITAS INDONESIA TBK.XA - NH KORINDO SEKURITAS INDONESIAYP - MIRAE ASSET SEKURITAS INDONESIA,2022-02-15,2022-02-24,160,170,2022-03-14,2022-03-17,2022-03-17,2022-03-18,21 Mar 2022,0.5,Rp 492
Closed,NANO,PT Nanotech Indonesia Global Tbk,Consumer Discretionary,Business Support Services,Akselerasi,Rp 100,0.1,0.1,0.0,0.2066115702479339,0.0958904109589041,0.1,-0.09090909090909091,-0.83,Penelitian & Pengembangan Ilmu Pengetahuan Alam & Teknologi Rekayasa Lainnya & Aktivitas Konsultasi,"Gedung Nanoplex, Jl. Puspiptek Komplek Batan Lama A12, Kota Tangerang Selatan, Provinsi Banten - 15314",https://nig.co.id,12.850.000 Lot,29.99%,AI - KAY HIAN SEKURITAS,AI - KAY HIAN SEKURITAS,2022-02-08,2022-02-15,95,105,2022-03-02,2022-03-08,2022-03-08,2022-03-09,10 Mar 2022,0.8,Rp 125
Closed,STAA,PT SUMBER TANI AGUNG RESOURCES Tbk,Consumer Staples,Plantations & Crops,Utama,Rp 600,0.25,0.24666666666666667,-0.06951871657754011,-0.06896551724137931,0.006172839506172839,0.0,-0.04294478527607362,0.44166666666666665,Perkebunan kelapa sawit & industri olah kelapa sawit baik secara langsung dan/atau Perusahaan Anak,"Jl. Pangeran Diponegoro No 51 Medan 20152, Sumatra Utara, Indonesia",http://sta.co.id,8.770.720 Lot,8.06%,DP - DBS VICKERS SEKURITAS INDONESIA,DP - DBS VICKERS SEKURITAS INDONESIAC3 - PT CIMB Niaga Sekuritas,2022-02-09,2022-02-15,470,605,2022-03-02,2022-03-08,2022-03-08,2022-03-09,10 Mar 2022,0.0,
Closed,SMKM,PT Sumber Mas Konstruksi Tbk,Materials,Heavy Constructions & Civil Engineering,Akselerasi,Rp 264,-0.09848484848484848,-0.09243697478991597,0.009259259259259259,0.0,-0.1834862385321101,-0.028089887640449437,0.08670520231213873,-0.6818181818181818,Jasa Konstruksi Umum,"Gedung Graha Mustika Ratu, Lantai 5 Jalan Jend. Gatot Subroto Kav. 74-75 Jakarta Selatan, 12870",http://www.konstruksimas.co.id/,2.500.000 Lot,19.95%,AO - ERDIKHA ELIT SEKURITAS,AO - ERDIKHA ELIT SEKURITAS,2022-02-04,2022-02-10,150,350,2022-03-02,2022-03-07,2022-03-07,2022-03-08,09 Mar 2022,0.0,
Closed,ADCP,PT ADHI COMMUTER PROPERTI TBK,Technology,Real Estate Development & Management,,Rp 130,-0.06153846153846154,-0.06557377049180328,-0.06140350877192982,-0.06542056074766354,-0.07,0.13978494623655913,-0.0660377358490566,-0.6153846153846154,Perhotelan dan Real Estate,"South Building PT Adhi Karya (Persero) Tbk, Jl. Raya Pasar Minggu, Km. 18 Jakarta Selatan, DKI Jakarta 12510",https://www.adcp.co.id,22.222.222 Lot,10%,AZ - SUCOR SEKURITAS,AZ - SUCOR SEKURITASC3 - PT CIMB Niaga SekuritasGR - PANIN SEKURITAS TBK.IP - YUGEN BERTUMBUH SEKURITASZP - MAYBANK SEKURITAS INDONESIARS - YULIE SEKURITAS INDONESIA TBK.YP - MIRAE ASSET SEKURITAS INDONESIA,2022-01-27,2022-02-07,130,200,2022-02-16,2022-02-21,2022-02-21,2022-02-22,23 Feb 2022,0.0,
Closed,NTBK,PT Nusatama Berkah Tbk,Consumer Discretionary,Construction Machinery & Heavy Vehicles,Pengembangan,Rp 100,0.35,-0.06666666666666667,-0.06349206349206349,-0.06779661016949153,-0.06363636363636363,0.04854368932038835,-0.037037037037037035,-0.5,Industri Manufaktur Kendaraan Khusus,"18 Office Park 6th Floor Suite C, Jl. TB Simatupang Kav. 18, Jakarta 12520, Indonesia",http://www.nusatama.com/,7.000.000 Lot,25.93%,SF - SURYA FAJAR SEKURITAS,SF - SURYA FAJAR SEKURITASII - DANATAMA MAKMUR SEKURITAS,2022-01-19,2022-01-27,100,150,2022-02-02,2022-02-07,2022-02-07,2022-02-08,09 Feb 2022,1.0,Rp 120
Closed,ENAK,PT Champ Resto Indonesia Tbk,Energy,Restaurants,Pengembangan,Rp 850,-0.029411764705882353,-0.012121212121212121,0.012269938650306749,-0.04242424242424243,-0.06329113924050633,-0.060810810810810814,0.014388489208633094,0.19411764705882353,bergerak dalam bidang restoran,"Jl. Raya Tanjung Barat No. 81A RT 002/04, Tanjung Barat, Jagakarsa, Jakarta Selatan 12530.",https://www.champ-group.com/,4.333.334 Lot,20%,AI - KAY HIAN SEKURITAS,AI - KAY HIAN SEKURITAS,2022-01-12,2022-01-20,800,950,2022-02-02,2022-02-04,2022-02-04,2022-02-07,08 Feb 2022,0.0,
Closed,BAUT,PT Mitra Angkasa Sejahtera Tbk,Energy,Home Improvement Retail,Pemantauan Khusus,Rp 100,0.35,0.34814814814814815,0.34065934065934067,-0.06557377049180328,-0.06140350877192982,-0.06542056074766354,-0.07,-0.82,"Bergerak dalam bidang Perdagangan Besar Logam untuk Bahan Konstruksi, terutama Mur dan Baut","Jl. Raya Tanjung Pasir KP. Pondok Bahagia No.18, Tegal Angus, Teluknaga, Tangerang, Banten 15510.",https://masworkspace.com,14.500.000 Lot,30.21%,AI - KAY HIAN SEKURITAS,AI - KAY HIAN SEKURITAS,2022-01-04,2022-01-10,100,110,2022-01-21,2022-01-26,2022-01-26,2022-01-27,28 Jan 2022,0.8,Rp 125
Closed,NETV,PT NET VISI MEDIA TBK,Energy,Broadcasting,Pemantauan Khusus,Rp 196,0.3469387755102041,0.25,0.24848484848484848,0.25,0.24271844660194175,-0.0625,-0.06666666666666667,-0.5867346938775511,Industri Media,"Graha Mitra Lt.4 Jl. Jend. Gatot Subroto Kav. 21 RT 003 RW 002, Karet Semanggi, Setiabudi",https://www.netvisimedia.co.id,7.653.061 Lot,4.37%,XA - NH KORINDO SEKURITAS INDONESIA,XA - NH KORINDO SEKURITAS INDONESIA,2021-12-27,2022-01-03,190,196,2022-01-19,2022-01-24,2022-01-24,2022-01-25,26 Jan 2022,0.0,
Closed,ASLC,PT Autopedia Sukses Lestari Tbk,Energy,Automotive Retail,Pengembangan,Rp 256,0.25,-0.06875,0.013422818791946308,-0.013245033112582781,-0.03355704697986577,0.05555555555555555,-0.019736842105263157,-0.6015625,Balai lelang melalui Entitas Anak dan perdagangan eceran mobil,"Gedung Graha Kirana Lt.6 Jl. Yos Sudarso No. 88 Sunter, Jakarta Utara 14350",https://www.autopedia.id,25.492.710 Lot,20%,LG - TRIMEGAH SEKURITAS INDONESIA TBK.,LG - TRIMEGAH SEKURITAS INDONESIA TBK.KI - CIPTADANA SEKURITAS ASIA,2021-12-29,2022-01-05,200,276,2022-01-19,2022-01-21,2022-01-21,2022-01-24,25 Jan 2022,0.0,
Closed,SEMA,PT SEMACOM INTEGRATED TBK,Consumer Discretionary,Electrical Components & Equipment,Pengembangan,Rp 180,0.34444444444444444,0.12396694214876033,-0.0661764705882353,-0.06299212598425197,0.01680672268907563,0.08264462809917356,0.0,-0.42777777777777776,"Produksi Panel, Perakitan Baterai Listrik dan Energi Terbarukan","Jl. Intan I RT 001/001, Kp. Poncol, Ds. Curug, Kec. Gunung Sindur, Bogor 16340, Jawa Barat",https://www.semacom-integrated.com,3.470.000 Lot,25.76%,XA - NH KORINDO SEKURITAS INDONESIA,XA - NH KORINDO SEKURITAS INDONESIA,2021-12-17,2021-12-22,180,220,2022-01-04,2022-01-06,2022-01-06,2022-01-07,10 Jan 2022,0.5,Rp 230
Closed,ADMR,PT Adaro Minerals Indonesia Tbk,Financials,Coal Production,Utama,Rp 100,0.35,0.34814814814814815,0.34065934065934067,0.2459016393442623,0.25,0.24736842105263157,0.24472573839662448,13.25,"Pertambangan batu bara metalurgi melalui Perusahaan Anak, jasa pertambangan dan konsultasi manajemen","Cyber 2 Tower Lantai 34, Jl. H.R. Rasuna Said Blok X-5 No.13, Jakarta 12950 - Indonesia",https://www.adarominerals.id,60.485.800 Lot,15%,KI - CIPTADANA SEKURITAS ASIA,KI - CIPTADANA SEKURITAS ASIA,2021-12-09,2021-12-16,100,125,2021-12-27,2021-12-29,2021-12-29,2021-12-30,03 Jan 2022,0.0,
Closed,DRMA,PT Dharma Polimetal Tbk,Energy,Auto Parts & Equipment,Utama,Rp 500,-0.008,-0.036290322580645164,0.0,0.07740585774058577,0.019417475728155338,0.0,-0.02857142857142857,1.16,Manufaktur Komponen Kendaraan Bermotor,"Jl. Angsana Raya Blok A9 No. 8 Delta Silicon I Kawasan Industri Lippo Cikarang Kelurahan Sukaresmi, Kecamatan Cikarang Selatan, Kabupaten Bekasi Jawa Barat - Indonesia",https://www.dharmagroup.co.id,7.058.823 Lot,15%,AZ - SUCOR SEKURITAS,AZ - SUCOR SEKURITASC3 - PT CIMB Niaga SekuritasEP - MNC SEKURITAS,2021-11-19,2021-11-30,500,620,2021-12-13,2021-12-16,2021-12-16,2021-12-17,20 Dec 2021,0.0,
Closed,BSML,PT Bintang Samudera Mandiri Lines Tbk,Real Estate,Logistics & Deliveries,Pengembangan,Rp 117,0.3418803418803419,-0.025477707006369428,-0.06535947712418301,-0.02097902097902098,-0.06428571428571428,0.06870229007633588,0.05714285714285714,-0.11965811965811966,Bergerak dalam angkutan laut dalam negeri untuk barang khusus serta perdagangan besar,"Rasuna Office Park OR, Jl. H. R. Rasuna Said, RT.16/RW.1, Menteng Atas, Kecamatan Setiabudi, Kota Jakarta Selatan, Daerah Khusus Ibukota Jakarta 12960",https://bsmlines.com/,3.700.450 Lot,20%,II - DANATAMA MAKMUR SEKURITAS,II - DANATAMA MAKMUR SEKURITAS,2021-11-16,2021-11-25,100,150,2021-12-09,2021-12-14,2021-12-14,2021-12-15,16 Dec 2021,0.0,
Closed,NASI,PT Wahana Inti Makmur Tbk,Consumer Staples,Food Retail & Distributors,Pengembangan,Rp 155,0.3419354838709677,0.17307692307692307,-0.06557377049180328,-0.06140350877192982,0.009345794392523364,0.018518518518518517,0.0,-0.43870967741935485,Bergerak dalam bidang Produsen dan Pemasok Beras,"Jalan Mohammad Husni Thamrin Kilometer 2, Duta Indah Iconic Tower G, Lantai 1, Kel. Panunggangan Utara, Kec. Pinang, Kota Tangerang, Prov. Banten, 15143",https://www.wahanaintimakmur.com,2.000.000 Lot,24.77%,AI - KAY HIAN SEKURITAS,AI - KAY HIAN SEKURITAS,2021-11-17,2021-11-23,140,160,2021-12-07,2021-12-09,2021-12-09,2021-12-10,13 Dec 2021,0.0,
Closed,IPPE,PT Indo Pureco Pratama Tbk,Consumer Staples,Household Products,Pemantauan Khusus,Rp 100,0.35,0.34814814814814815,0.34065934065934067,-0.06557377049180328,-0.06140350877192982,-0.06542056074766354,-0.07,-0.86,Industri minyak kelapa dan produk dari kelapa serta perdagangan,"Batununggul 1, Balingbing, Pagaden Barat. Subang, Jawa Barat, 41252",https://indopureco.com/,10.000.000 Lot,21.74%,HD - KGI SEKURITAS INDONESIA,HD - KGI SEKURITAS INDONESIAYP - MIRAE ASSET SEKURITAS INDONESIA,2021-11-18,2021-11-25,100,110,2021-12-02,2021-12-07,2021-12-07,2021-12-08,09 Dec 2021,0.0,
Closed,AVIA,PT Avia Avian Tbk,Utilities,Construction Materials,Utama,Rp 930,-0.06989247311827956,-0.03468208092485549,0.04790419161676647,0.022857142857142857,-0.0111731843575419,0.005649717514124294,0.033707865168539325,-0.46236559139784944,"Industri dan perdagangan cat dan tinta cetak, pernis, lak, perekat/lem, mortar atau beton siap pakai","Jl. Surabaya - Sidoarjo KM. 19, Kel. Wadungasih, Kec. Buduran, Sidoarjo 61254, Jawa Timur",https://www.avianbrands.com,62.000.000 Lot,10.01%,CC - MANDIRI SEKURITAS,CC - MANDIRI SEKURITASS0 - PT Morgan Stanley Sekuritas IndonesiaCS - CREDIT SUISSE SEKURITAS INDONESIALG - TRIMEGAH SEKURITAS INDONESIA TBK.PF - DANASAKTI SEKURITAS INDONESIAAK - UBS SEKURITAS INDONESIA,2021-11-12,2021-11-18,780,930,2021-12-02,2021-12-06,2021-12-06,2021-12-07,08 Dec 2021,0.0,
Closed,OBMD,PT OBM Drilchem Tbk,Utilities,Specialty Chemicals,Pengembangan,Rp 180,-0.06666666666666667,-0.06547619047619048,-0.06369426751592357,-0.02040816326530612,-0.020833333333333332,0.06382978723404255,-0.02666666666666667,0.28888888888888886,Memproduksi bahan aditif untuk mencegah kerugian dalam aktivitas pengeboran dengan teknologi serat,"Dipo Business Center 7th floor, Suite 7E Jl. Gatot Subroto Kav. 50-52, Jakarta 10260",http://www.drilchem.com/,1.820.000 Lot,24.86%,HD - KGI SEKURITAS INDONESIA,HD - KGI SEKURITAS INDONESIA,2021-11-18,2021-11-22,150,180,2021-12-02,2021-12-06,2021-12-06,2021-12-07,08 Dec 2021,0.5,Rp 180
Closed,RMKE,PT RMK Energy Tbk,Financials,Coal Distribution,Utama,Rp 206,-0.02912621359223301,-0.015,0.0,0.17766497461928935,-0.02586206896551724,-0.02654867256637168,0.02727272727272727,1.9368932038834952,Bergerak dalam bidang pertambangan batubara dan aktivitas perusahaan holding,"Wisma RMK Lantai 2 Jalan Puri Kencana Blok M4/1, Kembangan Selatan, Kembangan, Kota Adm. Jakarta Barat, DKI Jakarta 11610",http://www.rmkenergy.com/,8.750.000 Lot,20%,IU - INDO CAPITAL SEKURITAS,IU - INDO CAPITAL SEKURITASMG - SEMESTA INDOVEST SEKURITASAO - ERDIKHA ELIT SEKURITASMI - VICTORIA SEKURITAS INDONESIAKK - PHILLIP SEKURITAS INDONESIA,2021-11-10,2021-11-15,160,230,2021-11-30,2021-12-03,2021-12-03,2021-12-06,07 Dec 2021,0.0,
Closed,WMPP,PT Widodo Makmur Perkasa Tbk,Consumer Staples,"Fish, Meat, & Poultry",Pemantauan Khusus,Rp 160,,,,,,,,-0.925,"Peternakan Sapi & Ayam, Rumah Potong Hewan, Daging & Olahan, Pakan Ternak, Bahan Makanan, Konstruksi","Gedung Graha Widodo Makmur Jalan Raya Cilangkap No. 58, Cilangkap, Cipayung, Jakarta Timur, 13870",https://widodomakmurperkasa.co.id/,44.190.000 Lot,15.02%,SF - SURYA FAJAR SEKURITAS,SF - SURYA FAJAR SEKURITASC3 - PT CIMB Niaga SekuritasRS - YULIE SEKURITAS INDONESIA TBK.OD - BRI DANAREKSA SEKURITASIF - SAMUEL SEKURITAS INDONESIAYP - MIRAE ASSET SEKURITAS INDONESIACP - KB VALBURY SEKURITAS,2021-10-27,2021-11-09,160,220,2021-11-30,2021-12-02,2021-12-02,2021-12-03,06 Dec 2021,0.0,
Closed,WGSH,PT Wira Global Solusi Tbk,Telecom,IT Services & Consulting,Akselerasi,Rp 140,0.1,0.09740259740259741,0.09467455621301775,0.0918918918918919,0.09900990099009901,-0.0990990990990991,-0.1,-0.32857142857142857,Bergerak dalam bidang usaha Perdagangan Teknologi Informasi,"The Breeze BSD City L81 - 82 Jln. Grand Boulevard Kabupaten Tangerang Indonesia, 15345",https://www.wgshub.com/,2.085.000 Lot,20%,AH - SHINHAN SEKURITAS INDONESIA,AH - SHINHAN SEKURITAS INDONESIA,2021-11-09,2021-11-17,125,140,2021-11-30,2021-12-02,2021-12-02,2021-12-03,06 Dec 2021,0.0,
Closed,CMRY,PT Cisarua Mountain Dairy Tbk,Consumer Staples,Dairy Products,Utama,Rp 3.080,0.10714285714285714,-0.008797653958944282,0.04142011834319527,-0.02556818181818182,0.0029154518950437317,0.014534883720930232,-0.014326647564469915,0.7775974025974026,Bergerak di bidang usaha Produk Susu Premium dan Konsumen Premium,Rukan Taman Meruya Jl. Komp. Rukan Taman Meruya No.N/27-28 Jakarta Barat 11620 Indonesia,https://www.cimory.com,11.902.030 Lot,15%,CC - MANDIRI SEKURITAS,CC - MANDIRI SEKURITASGR - PANIN SEKURITAS TBK.KZ - CLSA SEKURITAS INDONESIA,2021-11-10,2021-11-17,2780,3160,2021-11-30,2021-12-02,2021-12-02,2021-12-03,06 Dec 2021,0.0,
Closed,TAYS,PT JAYA SWARASA AGUNG TBK,Consumer Staples,Processed Foods,Pengembangan,Rp 360,-0.06666666666666667,-0.023809523809523808,-0.06707317073170732,-0.06535947712418301,-0.04195804195804196,-0.0364963503649635,0.0,-0.7972222222222223,Industri Makanan Ringan,"Jalan Parung Panjang No. 68, Kp. Bungaok RT001/RW003 Desa Kemuning, Kecamatan Legok, Kabupaten Tangerang, Banten 15820.",https://www.taysbakers.com,2.403.000 Lot,21.87%,XA - NH KORINDO SEKURITAS INDONESIA,XA - NH KORINDO SEKURITAS INDONESIAHD - KGI SEKURITAS INDONESIA,2021-11-02,2021-11-08,336,360,2021-11-30,2021-12-02,2021-12-02,2021-12-03,06 Dec 2021,0.0,
Closed,DEPO,PT Caturkarda Depo Bangunan Tbk,Energy,Home Improvement Retail,Pengembangan,Rp 482,0.24481327800829875,0.03333333333333333,-0.04838709677419355,0.0423728813559322,-0.008130081300813009,0.0,-0.06557377049180328,-0.45228215767634855,Supermarket dan/atau Retai Bahan Bangunan,"Jl. Raya Serpong KM2, Kel. Pakulonan, Kec. Serpong Utara, Tangerang Selatan",https://depobangunan.co.id/,10.240.000 Lot,15.08%,YP - MIRAE ASSET SEKURITAS INDONESIA,YP - MIRAE ASSET SEKURITAS INDONESIA,2021-11-01,2021-11-08,426,525,2021-11-18,2021-11-23,2021-11-23,2021-11-24,25 Nov 2021,0.0,
Closed,BINO,PT Perma Plasindo Tbk,Consumer Discretionary,Office Supplies,Pengembangan,Rp 138,0.21014492753623187,-0.059880239520958084,0.012738853503184714,-0.06918238993710692,-0.05405405405405406,-0.007142857142857143,0.0,0.5652173913043478,Aktivitas perusahaan holding serta produksi dan distribusi alat tulis kantor melalui entitas anak,"Jl. Raya Boulevard Barat Blok LC VI No 23, Kelapa Gading Barat, Jakarta Utara, Indonesia 14240",https://www.permaplasindo.co.id/,4.350.000 Lot,20%,IU - INDO CAPITAL SEKURITAS,IU - INDO CAPITAL SEKURITASMG - SEMESTA INDOVEST SEKURITASKK - PHILLIP SEKURITAS INDONESIA,2021-10-28,2021-11-05,120,145,2021-11-18,2021-11-23,2021-11-23,2021-11-24,25 Nov 2021,0.5,Rp 168
Closed,MTEL,PT Dayamitra Telekomunikasi Tbk,Materials,Wireless Telecommunication Services,,Rp 800,-0.04375,0.013071895424836602,0.0,0.0,-0.0064516129032258064,-0.012987012987012988,0.02631578947368421,-0.2,Penyedia Jasa Menara Telekomunikasi,Telkom Landmark Tower Lt. 27 Jl. Gatot Subroto Kavling 52 Jakarta 12710,https://www.mitratel.co.id/,229.205.120 Lot,27.63%,CC - MANDIRI SEKURITAS,CC - MANDIRI SEKURITASS0 - PT Morgan Stanley Sekuritas IndonesiaGR - PANIN SEKURITAS TBK.GW - HSBC SEKURITAS INDONESIARS - YULIE SEKURITAS INDONESIA TBK.OD - BRI DANAREKSA SEKURITASIN - INVESTINDO NUSANTARA SEKURITASPF - DANASAKTI SEKURITAS INDONESIAIF - SAMUEL SEKURITAS INDONESIABK - J.P. MORGAN SEKURITAS INDONESIACP - KB VALBURY SEKURITAS,2021-10-26,2021-11-04,775,975,2021-11-16,2021-11-18,2021-11-18,2021-11-19,22 Nov 2021,0.0,
Closed,BOBA,PT Formosa Ingredient Factory Tbk,Consumer Staples,Processed Foods,Pengembangan,Rp 280,0.25,-0.005714285714285714,-0.05747126436781609,-0.06707317073170732,0.006535947712418301,-0.045454545454545456,0.047619047619047616,-0.35,"Produksi tapioca pearl, topping jelly, popping boba, premium sauce, syrup dan premix powder","Berlian 88 Biz Estate Blok C No.1 Jl. Diklat Pemda, Kelapa Dua Tangerang – Banten 15810",https://bobaking.co.id/,1.400.000 Lot,12.11%,MI - VICTORIA SEKURITAS INDONESIA,MI - VICTORIA SEKURITAS INDONESIA,2021-10-05,2021-10-11,250,280,2021-10-26,2021-10-28,2021-10-28,2021-10-29,01 Nov 2021,0.0,
Closed,KUAS,PT ACE OLDFIELDS TBK,Consumer Discretionary,Building Products & Fixtures,Pengembangan,Rp 195,0.3435897435897436,-0.04580152671755725,0.0,-0.064,-0.06837606837606838,-0.06422018348623854,-0.058823529411764705,-0.7333333333333333,Perseroan Bergerak Dalam Bidang Usaha Produksi Peralatan Dan Perlengkapan Pengecatan,"Jl. Raya Cileungsi Jonggol KM 22,5 RT.006 RW.002, Cileungsi, Bogor, 16820",https://www.aceoldfields.com,3.900.000 Lot,30.17%,XA - NH KORINDO SEKURITAS INDONESIA,XA - NH KORINDO SEKURITAS INDONESIA,2021-09-22,2021-09-27,195,250,2021-10-18,2021-10-21,2021-10-21,2021-10-22,25 Oct 2021,0.33,Rp 250
Closed,IDEA,PT Idea Indonesia Akademi Tbk,Energy,Education Services,Akselerasi,Rp 140,0.1,0.09740259740259741,-0.09467455621301775,-0.09803921568627451,-0.09420289855072464,-0.056,0.09322033898305085,-0.7571428571428571,"Akademi Pendidikan dan Pelatihan Perhotelan, Kapal Pesiar, Tata Boga dan Restoran Berbasis Industri","18 Office Park Lantai 10 Jalan TB Simatupang Kav. 18, RW.1, Kebagusan, Pasar Minggu, Jakarta Selatan, Daerah Khusus Ibukota Jakarta 12520",https://www.ideaindonesia.com,2.124.875 Lot,20%,IU - INDO CAPITAL SEKURITAS,IU - INDO CAPITAL SEKURITASKK - PHILLIP SEKURITAS INDONESIA,2021-08-13,2021-08-24,120,155,2021-09-02,2021-09-07,2021-09-07,2021-09-08,09 Sep 2021,0.0,
Closed,RSGK,PT Kedoya Adyaraya Tbk,Healthcare,Healthcare Providers,Utama,Rp 1.720,0.25,-0.046511627906976744,-0.05609756097560976,-0.046511627906976744,0.06233062330623306,-0.03571428571428571,-0.021164021164021163,-0.26744186046511625,Bergerak di bidang Aktivitas Rumah Sakit Swasta,"RS Grha Kedoya Jalan Panjang Arteri No. 26, Kedoya Utara, Kebon Jeruk, Jakarta 11520",https://www.grhahospitals.com,1.859.400 Lot,20%,RF - BUANA CAPITAL SEKURITAS,RF - BUANA CAPITAL SEKURITAS,2021-08-12,2021-08-24,1500,1750,2021-09-02,2021-09-06,2021-09-06,2021-09-07,08 Sep 2021,0.0,
Closed,GTSI,PT GTS Internasional Tbk,Real Estate,Logistics & Deliveries,Pemantauan Khusus,Rp 100,-0.07,-0.06451612903225806,-0.06896551724137931,0.0,-0.037037037037037035,-0.01282051282051282,-0.025974025974025976,-0.7,"distribusi gas alam dan buatan, transportasi laut dalam negeri dan luar negeri untuk barang khusus","Mangkuluhur City Tower One, lantai 26, Jl. Jend. Gatot Subroto Kav. 1-3 Jakarta 12930, Indonesia",https://gtsi.co.id/,24.000.000 Lot,15.17%,LS - RELIANCE SEKURITAS INDONESIA TBK.,LS - RELIANCE SEKURITAS INDONESIA TBK.,2021-08-20,2021-08-26,100,150,2021-09-02,2021-09-06,2021-09-06,2021-09-07,08 Sep 2021,0.0,
Closed,RUNS,PT Global Sukses Solusi Tbk,Telecom,IT Services & Consulting,Akselerasi,Rp 254,0.09448818897637795,0.09352517985611511,0.09868421052631579,0.09580838323353294,0.09836065573770492,0.09950248756218906,0.09954751131221719,-0.7637795275590551,"Informasi dan Komunikasi serta Perdagangan Besar & Eceran Piranti Lunak, Komputer & Perlengkapannya","Grha RUN System Jl. Pakuningratan No. 15, Yogyakarta, 55233",https://www.runsystem.id,1.968.000 Lot,20.01%,YP - MIRAE ASSET SEKURITAS INDONESIA,YP - MIRAE ASSET SEKURITAS INDONESIAOD - BRI DANAREKSA SEKURITAS,2021-08-20,2021-08-26,230,254,2021-09-02,2021-09-06,2021-09-06,2021-09-07,08 Sep 2021,0.0,
Closed,CMNT,PT Cemindo Gemilang Tbk,Utilities,Construction Materials,Utama,Rp 680,0.25,0.011764705882352941,-0.046511627906976744,-0.018292682926829267,0.012422360248447204,0.03067484662576687,0.023809523809523808,0.5220588235294118,Industri Semen,"Jl. Raya Pluit Selatan Blok S No. 8 I-J RT022/RW008, Penjaringan Jakarta Utara 14440, Indonesia",https://www.semenmerahputih.com,17.188.000 Lot,10.04%,KI - CIPTADANA SEKURITAS ASIA,KI - CIPTADANA SEKURITAS ASIACC - MANDIRI SEKURITASAK - UBS SEKURITAS INDONESIA,2021-08-09,2021-08-19,600,800,2021-09-02,2021-09-06,2021-09-06,2021-09-07,08 Sep 2021,0.0,
Closed,SBMA,PT Surya Biru Murni Acetylene Tbk,Utilities,Basic Chemicals,Pengembangan,Rp 180,0.34444444444444444,0.24793388429752067,0.24503311258278146,0.25,0.06382978723404255,-0.068,-0.06866952789699571,-0.28888888888888886,Bergerak di Bidang Industri Kimia Anorganik Gas,"Jalan Jendral Sudirman No. 5 - 6, Kelurahan Klandasan Ilir, Kecamatan Balikpapan Kota, Kota Balikpapan, Provinsi Kalimantan Timur 76113",https://www.suryabirumurni.co.id,2.784.000 Lot,29.99%,HD - KGI SEKURITAS INDONESIA,HD - KGI SEKURITAS INDONESIA,2021-08-19,2021-08-23,180,230,2021-09-02,2021-09-06,2021-09-06,2021-09-07,08 Sep 2021,0.17,Rp 230
Closed,MCOL,PT Prima Andalan Mandiri Tbk,Financials,Coal Production,Utama,Rp 1.420,0.10211267605633803,0.054313099041533544,0.006060606060606061,0.006024096385542169,-0.017964071856287425,-0.01524390243902439,-0.0030959752321981426,2.926056338028169,Pertambangan Batubara dan Jasa Pertambangan Melalui Entitas Anak,"Gedung Office 8, Lantai 28 SCBD Lot. 28, Jl. Jend. Sudirman Kav. 52 - 53, Kebayoran Baru, Jakarta 12190",https://www.mandiricoal.co.id,3.555.600 Lot,10%,RF - BUANA CAPITAL SEKURITAS,RF - BUANA CAPITAL SEKURITAS,2021-07-28,2021-08-16,1420,1600,2021-09-01,2021-09-03,2021-09-03,2021-09-06,07 Sep 2021,0.0,
Closed,OILS,PT Indo Oil Perkasa Tbk,Utilities,Agricultural Chemicals,Pengembangan,Rp 270,0.24444444444444444,0.25,0.25,0.24761904761904763,-0.06870229007633588,-0.06557377049180328,-0.06140350877192982,-0.6296296296296297,Pengolahan produksi kopra dan penjualan minyak kelapa,"Jalan Raya Perning No. 39, Kecamatan Jetis, Kabupaten Mojokerto, Jawa Timur 61352",https://www.indooilperkasa.com,1.500.000 Lot,33.04%,BQ - KOREA INVESTMENT AND SEKURITAS INDONESIA,BQ - KOREA INVESTMENT AND SEKURITAS INDONESIA,2021-08-09,2021-08-16,270,300,2021-08-31,2021-09-02,2021-09-02,2021-09-03,06 Sep 2021,0.25,Rp 320
Closed,GPSO,PT Geoprima Solusi Tbk,Telecom,Electronic Equipment & Instruments,Pengembangan,Rp 180,0.34444444444444444,-0.04132231404958678,-0.06896551724137931,-0.06481481481481481,-0.06930693069306931,0.02127659574468085,0.010416666666666666,-0.4111111111111111,"Perdagangan Besar Mesin, Peralatan dan Perlengkapan Lainnya","Rukan Artha Gading Niaga Blok D-9, Kelapa Gading, Jakarta Utara 14240",https://www.geoprima.co.id,1.666.666 Lot,25%,SF - SURYA FAJAR SEKURITAS,SF - SURYA FAJAR SEKURITASXA - NH KORINDO SEKURITAS INDONESIA,2021-08-09,2021-08-13,175,180,2021-08-30,2021-09-02,2021-09-02,2021-09-03,06 Sep 2021,1.0,Rp 250
